link,title,text
https://polsky.uchicago.edu/2024/03/21/transform-accelerator-announces-data-science-and-ai-startups-selected-for-cohort-3/,Transform Accelerator Announces Data Science and AI Startups Selected for Cohort 3,"The University of Chicago’s Polsky Center for Entrepreneurship and Innovation and Data Science Institute today announced the seven early-stage companies accepted into the third cohort of the Transform accelerator for data science and AI startups.

Powered by the Polsky Center’s Deep Tech Ventures, Transform provides full-spectrum support for the startups accepted into the accelerator, including access to business and technical training, industry mentorship, venture capital connections, and funding opportunities.

The seven startups will receive approximately $250,000 in total investment, including $25,000 in funding, credits for Google for Startups, workspace in the Polsky Exchange on Chicago’s South Side, and access to industry mentors, technical advisors and student talent from the University of Chicago Department of Computer Science, Data Science Institute (DSI), and the Chicago Booth School of Business.

Transform Cohort 3:

Autonoma: Making Modernizing Legacy Code Easy

Bettor Vision: Bringing All Your Fantasy Sports Betting Into One App

Complete Wellness Solutions: A Holistic, Data-Driven Approach to Population Health Management

Healee: Applying AI to Improve the Consumer Experience in Healthcare

iTrials: A User-Centric Design Philosophy to Transform Clinical Trial Patient Enrollment

Leaf Automation: Next-Generation AI-Enhanced CAD Plugins

Legman: Bringing AI to the Construction Industry

“I am excited to welcome cohort three into Transform, this cycle was particularly competitive and we are delighted with the seven companies we selected,” said Shyama Majumdar, director of Transform. “We have a good mix of healthcare, construction, manufacturing, and fintech companies represented as we continue to see generative AI startups leading the way, which is reflected in this cohort. After the success of cohort 2, we are ready to run with cohort 3 and help pave their way to success.”

The accelerator launched in Spring 2023 with its inaugural cohort and those startups are already seeing success. Echo Labs, a transcription platform in the previous cohort, has scaled up, hiring software engineers to meet the demand of partnerships with 150 universities to pilot their product. Blackcurrant, an online business-to-business marketplace for buying and selling hydrogen and member of the first cohort, recently was awarded a $250,000 co-investment from the George Shultz Innovation Fund after participating in the program.

“The continued success of Transform startups has been very encouraging,” said David Uminsky, executive director of the Data Science Institute. “The wide range of sectors this new cohort serves demonstrates AI’s increasing impact on business.”

Transform is partly supported by corporate partners McAndrews, Held & Malloy, Ltd and venture partner, True Blue Partners, a Silicon Valley-based venture capital firm investing in early-stage AI companies, founded by Chicago Booth alum Sunil Grover, MBA ‘99.

“Transform is providing the fertile ground necessary to help incubate the next generation of market leaders,” said Grover, who also is a former engineer with nearly two decades of experience helping build companies as an entrepreneur, investor, and advisor. “Advancements in deep tech present a unique interdisciplinary opportunity to re-imagine every aspect of the business world. This, I believe, will lead to creation of innovative new businesses that are re-imagined, ground up, to apply the capabilities these new technologies can enable.”"
https://mccourt.georgetown.edu/news/maggie-sullivan-msdspp-student-spotlight/,"Georgetown graduate student builds a career integrating international relations, data science and public policy","Maggie Sullivan (MS-DSPP’24), an international development specialist and emerging data scientist, has already lived and worked in three countries. She is well acquainted with the critical role that data plays in shaping U.S. foreign policy and the real-world impact of those policies on marginalized communities around the world.

As a soon-to-be-graduate of the McCourt School of Public Policy’s Master of Science in Data Science for Public Policy (MS-DSPP) program, Sullivan hopes to bridge the gap between gathering insights from data and making, and communicating, policy decisions that positively impact people’s lives.

While completing her undergraduate studies in international affairs at Western Kentucky University, Sullivan began her work with the U.S. Department of State through the highly competitive U.S. Foreign Service Internship Program, a merit and needs-based opportunity for undergraduates to experience diplomacy first-hand, in Washington, DC, and at a U.S. Embassy or Consulate abroad. She was one of 34 students selected among hundreds of qualified candidates.

As a U.S. Foreign Service intern, Sullivan kickstarted her career in international policy, dedicating seven weeks to refugee admissions in the Bureau of Population, Refugees, and Migration (PRM). There, she found data analytics, a discovery that changed her career trajectory.

“One of my initial tasks was developing a Tableau dashboard for PRM to help the team better understand where refugees were being resettled and thus, how to make more strategic funding decisions,” said Sullivan. “It was data visualization for impact.”

The following year, Sullivan spent 10 weeks working at the U.S. Embassy in Sarajevo, Bosnia, in the Political Section, followed by five months teaching English in Bulgaria. Upon returning home to the U.S., Sullivan began working with the U.S. Agency for International Development (USAID), including two years as a program analyst supporting an interagency strategy on foreign aid for vulnerable children and families. Before starting at McCourt, she spent six months as a Communications Specialist for USAID in Rabat, Morocco.

At USAID, Sullivan reflected on what she wanted to do next with her career and the skills she needed to acquire to move forward.

“I saw how the government collects data, and I wanted to learn how to better utilize it,” she said. “I didn’t have the quantitative and data analysis skills I would need to be successful, so I turned to the McCourt School without hesitation.”

Using technology in service of the common good

Sullivan had not taken a math class since high school and initially struggled to adjust to the quantitative rigor of the MS-DSPP program. With the support of her professors and the comradery of her fellow MS-DSPP classmates, Sullivan excelled.

With renewed confidence in her abilities, Sullivan delved deeper into the intersection of technology and public policy by getting involved in the Georgetown Technology Policy Initiative (GTPI) and engaging in discussions in her Public Interest Tech class, taught by Emily Tavoulareas, chair of Georgetown University’s Tech & Society initiative. Outside of the classroom, she is actualizing data for impact with the McCourt School’s Massive Data Institute (MDI) and the Beeck Center for Social Impact + Innovation. She is also working with Rebecca Johnson, assistant professor and affiliate of MDI, on a new research project that leverages advances in computing to create a first-of-its-kind systematic database of school board meeting deliberations.

As GTPI’s communications chair, Sullivan is charged with developing creative content that explains the science behind data buzzwords —“everything from AI to machine learning.”

“Many tech policy experts are talking past technologists, using different terms and definitions. I’m prepared now to help translate that work for different audiences,” she said.

“I want to help people understand that technology can be used to develop innovative solutions to the complex problems of today — all in service of the common good.”"
https://www.marktechpost.com/2024/04/14/top-data-analytics-books-to-read-in-2024/,Top Data Analytics Books to Read in 2024,"In today’s data-driven world, data analytics plays a key role in helping organizations make better decisions, identify opportunities, and mitigate risks. Data analytics enables businesses to gain insights into customer preferences and market dynamics, enhancing overall performance. As such, the demand for competent analysts has increased significantly over the past few years. This article lists the top data analytics books one should read in 2024 to augment one’s skills and stay ahead in this rapidly evolving field.

Python for Data Analysis

“Python for Data Analysis” is a comprehensive guide to manipulating, processing, and cleaning datasets in Python. It covers the tools to load, clean, transform, merge, and reshape data, focusing on libraries like Pandas and Numpy. The book also teaches how to solve real-world problems with detailed examples.

Fundamentals of Data Analytics

This book is a guide to the data analytics process, providing a five-step framework to help readers start the journey of analyzing data. The book covers the data mining and machine learning principles and provides strategies to build a problem-solving mindset.

Data Analytics for Absolute Beginners

This book is aimed at beginners and provides an introduction to data, data visualization, business intelligence, and statistics. The book consists of numerous practical and visual examples, along with coding exercises in Python. It also covers some of the machine learning concepts like regression, classification, and clustering.

Everything Data Analytics

“Everything Data Analytics” is a beginner’s guide to data literacy that helps understand the process of turning data into insights. The book covers the process of data collection, management, and storage, along with the essential machine-learning algorithms necessary for analysis, like regression, classification, and clustering.

SQL for Data Analysis

“SQL for Data Analysis” covers improving one’s SQL skills and making the most of SQL as part of their workflow. The book provides some advanced techniques for transforming data into insights, covering topics like joins, window functions, subqueries, and regular expressions.

Advancing into Analytics

This is a practical guide for Excel users to help them gain an understanding of analytics and the data stack. The author covers the key statistical concepts with spreadsheets and helps Excel users transition to performing exploratory data analysis and hypothesis testing using Python and R.

Modern Data Analytics in Excel

This book covers the features of modern Excel and the powerful tools for analytics. The author teaches how to leverage tools like Power Query and Power Pivot to build repeatable data-cleaning processes and create relational data models and analysis measures. The book also covers using AI and Python for more advanced Excel reporting.

Data Visualization with Excel Dashboards and Reports

This book teaches how to analyze large amounts of data in Excel and report them in a meaningful way. It also teaches the fundamentals of data visualization and covers how to automate redundant reporting and analyses.

Data Analysis for Business, Economics, and Policy

This book is a practical guide to using tools to carry out data analysis to support better decision-making in business, economics, and policy. The book covers topics like data wrangling, regression analysis, and causal analysis, along with numerous case studies with real-world data.

Storytelling with Data

“Storytelling with Data” is a data visualization guide for business professionals. The book teaches how to convert the data into a high-impact visual story to resonate the message with the audience.

Fundamentals of Data Visualization

This book provides a guide to making informative and compelling figures that help convey a compelling story. The book also provides extensive examples of good and bad figures.

Data Visualization: A Practical Introduction

This book covers how to create compelling visualizations using R programming language, more specifically using the ggplot2 library. It covers topics like plotting continuous and categorical variables, grouping, summarizing, and transforming data for plotting, creating maps, and refining plots to make them more understandable.

Naked Statistics

“Naked Statistics” is a beginner-friendly book focusing on the underlying intuition driving statistical analysis. The book covers topics like inference, correlation, and regression analysis in a witty and funny manner, which simplifies the learning process.

The Art of Statistics

“The Art of Statistics” is a practical guide to using data and mathematics to understand real-world problems better. The book covers how to clarify questions and assumptions and interpret the results.

Essential Math for Data Science

This book teaches the mathematics essential for excelling in data science, machine learning, and statistics. It covers topics like calculus, probability, linear algebra, and statistics, as well as their applications in algorithms like linear regression and neural networks.

Practical Statistics for Data Scientists

This book covers how to apply statistical methods to data science using programming languages like Python and R. It emphasizes the importance of exploratory data analysis and also covers the underlying statistical concepts behind supervised and unsupervised machine learning algorithms.

Business unIntelligence

This book talks about the ever-changing and complex business intelligence landscape in today’s world. It covers numerous new models that businesses can leverage to design support systems for future successful organizations.

Data Science for Business

This book covers how organizations can leverage data science to gain a competitive advantage. It talks about general concepts that are useful in extracting knowledge from data. The book also provides various real-world examples to explain different concepts.

The Model Thinker

This book guides how to organize, apply, and understand the data that is being analyzed to become a true data ninja. The book covers mathematical, statistical, and computational models such as linear regression and random walks and provides a toolkit for its readers to make them leverage data to their advantage.

Becoming a Data Head

“Becoming a Data Head” teaches how to think, speak, and understand data science and statistics. It also covers the recent trends in machine learning, text analytics, and artificial intelligence.

We make a small profit from purchases made via referral/affiliate links attached to each book mentioned in the above list."
https://www.nichd.nih.gov/about/org/od/odss,Office of Data Science and Sharing (ODSS),"ODSS was established in 2021 to lead and coordinate NICHD’s activities within data science, bioinformatics, data sharing policy and compliance, and emerging technologies.

ODSS's vision is to enable a culture of responsible and innovative use of data and biospecimens that accelerates research and improves health for NICHD populations. The office's mission is to:

Develop a diverse, secure, and interoperable research data ecosystem

Advise on best practices for data collection, standards, management, sharing, and use across the research and funding lifecycles

Advance scientific discovery in support of NICHD's mission to understand human development, improve reproductive health, enhance the lives of children and adolescents, and optimize abilities for all

ODSS is a trusted informational resource for NICHD staff and researchers on all NIH data and specimen sharing policies.

ODSS serves as NICHD's primary liaison with the NIH Office of the Director's Office of Data Science and Strategy, to ensure engagement in large NIH data-science and emerging technology programs and ensure alignment with NIH, HHS, and federal programs and policies.

Director Rebecca Rosen’s presentation (PDF 2.2 MB) from the January 2023 Council provides an overview of ODSS activities.

ODSS is a trusted informational resource for NICHD staff and researchers on all NIH data sharing policies.

The new NIH DMS Policy applies to funding applications and proposals submitted to NIH on or after January 25, 2023. The following are helpful links about the new policy for the NICHD investigator community:

Explore the NIH Scientific Data Sharing website for information on:

Getting Ready for NIH’s DMS Policy (PDF 257 KB)

2023 DMS Policy FAQs

Submitting Genomic Data

Repositories for Sharing Scientific Data

Data Sharing Policy Trainings & Events

Use NICHD’s Tips for Writing a DMS Plan (PDF 193 KB) to create a DMS plan for your NIH-funded research projects

Learn about common data standards that may be relevant to NICHD research and how adopting them can improve data usability and interoperability throughout the data lifecycle.

Search the NICHD Data Repository Finder to identify an existing data repository to include in your DMS plan. Data repositories relevant to NICHD researchers will be added to the tool, currently in beta version, on an ongoing basis

Check out the following example DMS plans developed by NICHD staff:

Human Clinical and Genomics Data (PDF 215 KB)

Human Clinical Trial Data (PDF 179 KB)

Human Survey Data (PDF 169 KB)

Model Organism (Zebrafish) Data (PDF 124 KB)

Develop informed consent language that addresses data and specimen sharing using:

Informed Consent for Secondary Research and Biospecimens: Points to Consider and Sample Language for Future Use and/or Sharing (PDF 736 KB) developed by the NIH Office of Science Policy

Consent Templates and Guidance that Address Storage, Sharing, and Future Research Using Your Specimens and Data developed by the NIH Office of Intramural Research, Office of Human Subjects Research Protections

Test and provide feedback on the Federal Demonstration Partnership (FDP) NIH DMS Plan Pilot :

Use the Alpha or Beta DMS Plan templates to develop and submit your DMS Plan and provide feedback on the templates’ effectiveness and usability. The Alpha template guides the user through a structured, modular approach to limit the need for free text entry, while the Bravo template provides detailed prompts for each type of data and options for more free text entry. Templates are available on FDP website or through the DMPTool .

Read Best Practices for Sharing Research Software Frequently Asked Questions developed by the NIH Office of Data Science Strategy

DASH is a centralized resource for researchers to store, share, and access de-identified data from studies funded or conducted by NICHD. It also serves as a portal for requesting biospecimens from selected studies within the hub.

E-updates from DASH, published quarterly, provide information on upcoming NICHD data-collection projects, studies available in DASH, including those with biospecimens, as well as other noteworthy data news.

DASH E-Updates

September 2023 Update (PDF 357 KB)

June 2023 Update (PDF 451 KB)

March 2023 Update (PDF 309 KB)

December 2022 Update (PDF 279 KB)

September 2022 Update (PDF 367 KB)

June 2022 Update (PDF 321 KB)

March 2022 Update (PDF 320 KB)

December 2021 Update (PDF 265 KB)

September 2021 Update (PDF 232 KB)

July 2021 Update (PDF 234 KB)

March 2021 Update (PDF 248 KB)

In collaboration with NICHD, NIH, and external stakeholders, ODSS is building a federated, secure research and specimen data ecosystem that will measurably and rapidly facilitate data and specimen sharing by NICHD-funded researchers and increase access to shared data and specimens for the entire research community.

The NICHD Data Ecosystem includes people, data, processes, and technologies that align with the NICHD Strategic Plan and that support NICHD communities’ data science and sharing needs. In addition, ODSS is collecting “user stories” to describe these needs, within the following contexts:

NICHD investigators share their data and biospecimens to encourage reproducibility and broad reuse.

The researcher community:

Finds and uses NICHD data and specimens to enable new and innovative research

Securely analyzes NICHD and other data using new tools, training resources, and powerful computing resources

Participant communities visualize outcomes of taking part in NICHD research and benefit faster from new discoveries.

NICHD:

Tracks researcher compliance with NIH policies and good stewardship of government funds

Assesses and visualizes the scientific return on investment in data and biospecimen sharing

Promotes successful sharing strategies, policies, and tools to encourage broader use and reuse

ODSS is currently assessing all data repositories that NICHD researchers use to share data or access shared data for secondary use. This assessment and the communities’ user stories will inform NICHD’s approach to improving sustainability and interoperability across the ecosystem to best support the institute’s needs. The office will also use information from the assessment to update the NICHD Data Repository Finder .

ODSS leads and collaborates on a variety of projects to maximize the responsible and innovative use of data across the NICHD Data Ecosystem. Reports based on these projects will be posted in this section as they become available.

Privacy Preserving Record Linkage (PPRL) for Pediatric COVID-19 Studies (PDF 4 MB)

Led by ODSS with funding from the NIH Office of Data Science Strategy and support from Booz Allen Hamilton

This report describes governance and technical approaches for PPRL based on an assessment of existing record linkage implementations. The assessment was designed to address pediatric COVID-19 use cases identified by NICHD and NIH researcher communities, given the federated nature of the NIH data ecosystem. The report proposes a set of governance and technical considerations that could inform the design of any PPRL implementation in a federated data ecosystem.

Digitizing Data Governance Metadata Towards Streamlining Patient- Centered Outcomes Research Data Linkages

Led by ODSS with funding from the HHS Office of Secretary Patient-Centered Outcomes Research Trust Fund

The project strives to develop and test a generalizable, scalable, and machine-readable data governance metadata schema that simplifies decision-making for data linkage in patient-centered outcomes research and the subsequent use of linked datasets. Building on the PPRL for Pediatric COVID-19 Studies Report, this project is driven by pediatric COVID-19 research use cases that involve the linkage of several HHS and other federally funded datasets. Documents and materials will be publicly shared as they become available."
https://edsource.org/2024/data-science-helps-students-of-color-opt-in-for-more-math/707341,Data Science helps students of color opt in for more math,
