link,title,text
https://towardsdatascience.com/the-4-hats-of-a-full-stack-data-scientist-5b916bd2f079,The 4 Hats of a Full-Stack Data Scientist,"This is the first article in a larger series on “Full Stack Data Science” (FSDS). Although there are distinct roles for different aspects of a machine learning (ML) project, there is often a need for someone who can manage and implement projects end-to-end. This is what we can call a full-stack data scientist. In this article, I…"
https://www.kdnuggets.com/5-free-courses-to-master-math-for-data-science,5 Free Courses to Master Math for Data Science,"Image by storyset on Freepik

When you’re learning data science, building a good foundation in math will make your learning journey easier and much more effective. Even if you’ve already landed your first data role, learning math fundamentals for data science will only take your skills further.

From exploratory data analysis to building machine learning models, having a good foundation in math topics like linear algebra and statistics will give you a better understanding of why you do what you do. So even if you are a beginner, this list of courses will help you learn:

Basic math skills

Calculus

Linear Algebra

Probability and Statistics

Optimization

Sounds interesting, yes? Let’s get started!

1. Data Science Math Skills – Duke University

Data science courses require you to be comfortable with math as a prerequisite. To be specific, most courses assume that you're comfortable with high school algebra and calculus. But no worries if you are not there yet.

The Data Science Math Skills course, offered by Duke University on Coursera will help you get up and running with math fundamentals in as little time as possible. The topics covered in this course include:

Problem solving

Functions and graphs

Intro to calculus

Intro to probability

It’s recommended that you go through this course before you start the other courses that explore specific math topics in greater depth.

Link: Data Science Math Skills – Duke University on Coursera

2. Calculus – 3Blue1Brown

When we talk about math for data science, calculus is definitely something you should be comfortable with. But most learners find high school calculus intimidating (I’ve been there, too!). This, however, is partly because of how we learn—mostly focusing on concepts, a small number of illustrative examples, and a ton of practice exercises.

But you’ll understand and learn calculus much better if there are helpful visualizations—to help go from intuition to equation—focusing on the why.

The Calculus course by Grant Sanderson of 3Blue1Brown is exactly what all of us need! Through a series of lessons with super helpful visualizations—going from geometry to formula wherever possible—this course will help you learn the following and more:

Limits and derivatives

Power rule, chain rule, product rule

Implicit differentiation

Higher order derivatives

Taylor series

Integration

Link: Calculus - 3Blue1Brown

3. Linear Algebra – 3Blue1Brown

As a data scientist, the datasets that you work are essentially matrices of dimensions num_samples x num_features. You can, therefore, think of each data point as a vector in the feature space. So understanding how matrices work, common operations on matrices, matrix decomposition techniques are all important.

If you loved the calculus course from 3Blue1Brown, you’ll probably enjoy the linear algebra course from Grant Sanderson just as much if not more. The Linear Algebra course from 3Blue1Brown will help you learn help you learn the following:

Fundamentals of vectors and vector spaces

Linear combinations, span, and basis

Linear transformation and matrices

Matrix multiplication

3D linear transformation

Determinant

Inverses, column space, and null space

Dot and cross products

Eigenvalues and eigenvectors

Abstract vector spaces

Link: Linear Algebra - 3Blue1Brown

4. Probability and Statistics – Khan Academy

Statistics and probability are great skills to add to your data science toolbox. But they are by no means easy to master. However, it’s relatively easier to get your fundamentals down and build on them.

The Statistics and Probability course from Khan Academy will help you learn the probability and statistics you need to start working with data more effectively. Here is an overview of the topics covered:

Analyzing categorical and quantitative data

Modeling data distributions

Probability

Counting, permutations, and combinations

Random variables

Sampling distribution

Confidence interval

Hypothesis testing

Chi-square test

ANOVA

If you’re interested in diving deep into statistics, also check out 5 Free Courses to Master Statistics for Data Science.

Link: Statistics and Probability - Khan Academy

5. Optimization for Machine Learning – ML Mastery

If you’ve ever trained a machine learning model, you know that the algorithm learns the optimal values of the parameters of the model. Under the hood, it runs an optimization algorithm to find the optimal value.

The Optimization for Machine Learning Crash Course from Machine Learning Mastery is a comprehensive resource to learn optimization for machine learning.

This course takes a code-first approach using Python. So after understanding the importance of optimization, you’ll write Python code to see popular optimization algorithms in action. Here’s an overview of the topics covered:

The need for optimization

Grid search

Optimization algorithms in SciPy

BFGS algorithm

Hill climbing algorithm

Simulated annealing

Gradient descent

Link: Optimization for Machine Learning Crash Course - MachineLearningMastery.com

Wrapping Up

I hope you found these resources helpful. Because most of these courses are tailored towards beginners, you should be able to pick up all the essential math without feeling overwhelmed.

If you’re looking for courses to learn Python for data science, read 5 Free Courses to Master Python for Data Science.

Happy learning!"
https://consumergoods.com/nestle-uses-ai-and-data-science-battle-environmental-challenges-coffee-production,Nestlé Uses AI and Data Science to Battle Environmental Challenges in Coffee Production,"Nestlé is brewing up data science- and artificial intelligence-powered innovations to breed climate-resilient plants in an environmentally challenged landscape.

With climate change reducing the amount of land that can grow hardy and weather-resilient coffee plants, Nestlé plant scientists have looked to data science to better identify a combination of factors that will yield healthy crops.

Using AI, the company scans a publicly available digital database of coffee traits including cherry size, flavor and aroma characteristics, and yield to create more sustainable coffee cultivation and plant more disease- and drought-resistant beans.

Also read:Keurig Dr Pepper Tests Plastic-Free Pods, Powers Innovation With Consumer Learnings

""In simple terms, our new reference is like a high-quality map of a big city. It will help us identify key genetic markers in the Arabica genome that are responsible for specific traits in adult plants,” said Jeroen Dijkman, head of Nestlé's Institute of Agricultural Sciences, in a statement. “This will help our plant scientists and other experts to better identify, select, and breed new and improved arabica coffee varieties.""

Genome Sequencing of Arabica Coffee Strains

The company has focused on Arabica because it makes up 70% of the world’s coffee production among the existing 120 species. This has posed a challenge, however, as it is more susceptible to disease and has a lower heat tolerance, making it harder to plant successfully amid water shortages and a reduction of arable land.

Also read:Starbucks Reinvention: New Leadership and Green Store Expansion

The company sought a solution to this challenge alongside the French National Institute for Sustainable Development and academic partners, members of a global consortium.

Co-author of a research paper on this effort, Patrick Descombes, who is the senior expert in genomics at Nestlé Research, said the company used state-of-the-art genomics approaches to create an advanced, complete, and continuous arabica reference.

The initiative is part of Nestlé's regenerative agriculture plan, Nescafé Plan 2030.

The coffee segment has been steadily growing. According to research from Circana, coffee outpaced both tea (+4%) and carbonated soft drinks (+3%) in year-over-year servings growth, making it one of the fastest-growing beverage categories globally.

Nestlé reports that coffee is part of five growth platforms that make up 50% of its revenue. Within powdered and liquid beverages, coffee sales grew at a high single-digit rate, per the last call with investors.

The company’s coffee brands include Nescafe, Nespresso, Dolce Gusto, Starbucks Coffee at Home, and Blue Bottle Coffee."
https://fortune.com/education/articles/free-data-analytics-courses/,10 free data analytics courses you can take online,"“It’s not hyperbole to say that data analytics has really taken over the world,” says Brian Caffo, professor of biostatistics at Johns Hopkins University’s Bloomberg School of Public Health and director of academic programs for the university’s Data Science and AI Institute. “Every domain has become increasingly quantitative to inform decision making.”

And this space isn’t slowing down anytime soon: The U.S. Bureau of Labor Statistics projects that employment for data scientists will grow 35% from 2022 to 2032, with 17,700 new job openings projected each year on average during that decade.

Interested in becoming a data analyst? Below, we’ve compiled ten free data analytics courses to help give you a firmer grasp of this rapidly growing field.

A/B Testing

About: This course covers the design and analysis of A/B tests, which are online experiments that compare two versions of content to see which one appeals to viewers more. A/B tests are used throughout the tech industry by companies like Amazon and Google. This course is offered through Udacity.

Course length: Six self-paced modules

Who this course is for: Beginners

What you’ll learn: In this course you’ll learn about A/B testing, experiment ethics, how to choose metrics, design an experiment, and analyze results.

Prerequisites: None

Data Analytics Short Course

About: In this quick, five-tutorial course you’ll get a broad overview of data analytics. You’ll learn about the different types of roles in data analytics, a summary of the tools and skills you’ll need to develop, and a hands-on introduction to the field. This course is offered by CareerFoundry.

Course length: 75 minutes, divided into five 15-minute lessons

Who this course is for: Beginners

What you’ll learn: In this course you’ll get an introduction to data analytics. You’ll also analyze a real dataset to solve a business problem through data cleaning, visualizations, and garnering final insights.

Prerequisites: None

Data Science: R Basics

About: This program gives you a foundational knowledge of programming language R. Offered by HarvardX through the EdX platform, this course is offered for free; the paid version includes a credential. It’s the first of ten courses HarvardX offers as part of its Professional Certificate in Data Science.

Course length: Eight weeks, 1–2 hours per week

Who this course is for: Beginners

What you’ll learn: In this course you’ll learn basic R syntax and foundational R programming concepts, including data types, vectors arithmetic, and indexing. You’ll also perform operations that include sorting, data wrangling using dplyr, and making plots.

“It’s the basics of how to wrangle, analyze, and visualize data in R,” says Dustin Tingley, Harvard University’s deputy vice provost for advances in learning and a professor of government in the school’s government department. “That gets you writing a little bit of code, but you’re not doing anything that heavy.”

Prerequisites: HarvardX recommends having an up-to-date browser to enable programming directly in a browser-based interface

Fundamentals of Qualitative Research Methods

About: This course will teach you the fundamentals of qualitative research methods. Qualitative research provides deeper insights into real-world problems that might not always be immediately evident. This course is offered through Yale University on YouTube.

Course length: 90 minutes spread out over six modules

Who this course is for: Beginners

What you’ll learn: In this course you’ll learn how qualitative research is a way to systematically collect, organize, and interpret information that is difficult to measure quantitatively. This includes developing qualitative research questions, gathering data through interviews and focus groups, and analyzing this data.

“Qualitative research is the systematic, rigorous application of narratives and tools to better understand a complex phenomenon,” says Leslie Curry, a professor of public health and management at the Yale School of Public Health and a professor of management at the Yale School of Management. She adds that this approach can help understand flaws in large data sets. “It can be used as an adjunct to a lot of the really important work that’s happening in large data analysis.”

Prerequisites: None

Getting and Cleaning Data

About: This course covers the basic ways that data can be obtained and how that data can be cleaned to make it “tidy.” It will also teach you the components of a complete data set, such as raw data, codebooks, processing instructions, and processed data. This course is offered by Johns Hopkins University through Coursera, and is part of a 10-course Data Science Specialization series.

Course length: Four weeks, totaling approximately 19 hours

Who this course is for: Beginners

What you’ll learn: Through this course you’ll learn about common data storage systems, how to use R for text and date manipulation, how to use data cleaning basics to make data “tidy,” and how to obtain useable data from the web, application programming interfaces (APIs), and databases.

“It’s the starting point” when it comes to data analysis, Caffo says. “Without a good data set that is cleaned and appropriate for use, you have nothing. You can talk all you want about doing models or whatnot—underlying that has to be the data to support it.”

Prerequisites: None

Introduction to Data Science with Python

About: This course teaches you concepts and techniques to give you a foundational understanding of data science and machine learning. Offered by HarvardX through the EdX platform, this course can be taken for free. The paid version offers a credential.

Course length: Eight weeks, 3–4 hours a week

Who this course is for: Intermediate

What you’ll learn: This course will give you hands-on experience using Python to solve real data science challenges. You’ll use Python programming and coding for modeling, statistics, and storytelling.

“It gets you up and running with the main workhorse tools of data analytics,” says Tingley. “It helps to set people up to take more advanced courses in things like machine learning and artificial intelligence.”

Prerequisites: None, but Tingley says having a basic background in high school-level algebra and basic probability is helpful. Some programming experience—particularly in Python—is recommended

Introduction to Databases and SQL Querying

About: In this course you’ll learn how to query a database, create tables and databases, and be proficient in basic SQL querying. This free course is offered through Udemy.

Course length: Two hours and 17 minutes

Who this course is for: Beginners

What you’ll learn: This course will acquaint you with the basic concepts of databases and queries. This course will walk you through setting up your environment, creating your first table, and writing your first query. By the course’s conclusion, you should be able to write simple queries related to dates, string manipulation, and aggregation.

Prerequisites: None

Introduction to Data Analytics

About: This course offers an introduction to data analysis, the role of a data analyst, and the various tools used for data analytics. This course is offered by IBM through Coursera.

Course length: Five modules totaling roughly 10 hours

Who this course is for: Beginners

What you’ll learn: This course will teach you about data analytics and the different types of data structures, file formats, and sources of data. You’ll learn about the data analysis process, including collecting, wrangling, mining, and visualizing data. And you’ll learn about the different roles within the field of data analysis.

Prerequisites: None

Learn to Code for Data Analysis

About: This course will teach you how to write your own computer programs, access open data, clean and analyze data, and produce visualizations. You’ll code in Python, write analyses and do coding exercises using the Jupyter Notebooks platform. This course is offered through the United Kingdom’s Open University on its OpenLearn platform.

Course length: Eight weeks, totaling 24 hours

Who this course is for: Intermediate

What you’ll learn: In this course you’ll learn basic programming and data analysis concepts, recognize open data sources, use a programming environment to develop programs, and write simple programs to analyze large datasets and produce results.

Prerequisites: A background in coding—especially Python—is helpful

The Data Scientist’s Toolbox

About: This course will give you an introduction to the main tools and concepts of data science. You will learn the ideas behind turning data into actionable knowledge and get an introduction to tools like version control, markdown, git, GitHub, R, and RStudio. This course is offered by Johns Hopkins University through Coursera, and is part of a 10-course Data Science Specialization series.

Course length: 18 hours

Who this course is for: Beginners

What you’ll learn: This course will teach you how to set up R, RStudio, GitHub, and other tools. You will learn essential study design concepts, as well as how to understand the data, problems, and tools that data analysts use.

“That course is a very accessible introduction for anyone who wants to get started in this,” Caffo says. “It’s an overview that covers the full pipeline, from things like collecting and arranging data to asking good questions, all the way to creating a data deliverable.”

Prerequisites: None

The takeaway

From businesses estimating demand for their products to political campaigns figuring out where they should run advertisements to health care professionals running clinical trials to judge a drug’s efficacy, data analytics has a wide variety of applications. Getting a better understanding of the field on your own time can be done easily and freely. And the field is only growing.

“Just about every field is having a revolution in data analytics,” Caffo says. “In fields like medicine that have always been data driven, it’s become more data-driven.”"
https://towardsdatascience.com/simulated-data-real-learnings-simulating-systems-79374a9379fd,"Simulated Data, Real Learnings : Simulating Systems","INTRODUCTION

Simulation is a powerful tool in the data science tool box. In this article, we’ll talk about how simulating systems can help us formulate better strategies and make better decisions."
